*Capsella bursa-pastoris (L.) Medik.	shepherd's purse (Eng.); capselle bourse-à-pasteur (Fr.); ĭ'ckode'wadji'bĭk (Ojibwa)	Whole plant: Decoction used in dysentery [Ojibwa: 47].
 Brassicaceae, Herb		
Cardamine diphylla (Michx.) Alph. Wood Syn.: Dentaria diphylla Michx.	toothwort, pepper-root (Eng.); dentaire à deux feuilles, snicroûte, carcajou (Fr.); ka'djiwuk (Malecite)	Roots: Tea given for fever in children. Mixed with sweetflag in a tea used for heart disease [Algonquin: 69]. Chewed (green or dried) for hoarseness or to clear throat. Steeped and given as a tonic [Malecite: 65].
 Brassicaceae, Herb		
Carex aquatilis Wahlenb.	sedge (Eng.); carex aquatique (Fr.); tlh'oghtsëné (Chipewyan)	Roots: Used to induce menstruation [Dene: 13; Chipewyan: 92] or as part of a compound tea for intestinal problems [Dene: 13].
Cyperaceae, Herb		
*Carum carvi L.	caraway (Eng.); carvi commun, anis, (Fr.); sīcisis, iskotawutupe (Cree)	Analgesic [Abenaki: 67]. Boiled with 'Petasites sagittatus to treat chickenpox [Dene: 17]. 
Apiaceae, Herb		Rhizomes and seeds: Used as a corrective and adjuvant, and to relieve colic [Cree: 74]. 
		Seeds: Tea given to children to treat cough [Cree: 13]. 
Carya cordiformis (Wangenh.) K. Koch	bitternut hickory (Eng.); caryer cordiforme, noyer amer (Fr.)	Oil used in rheumatism [91]. 
Juglandaceae, Tree		
Carya laciniosa (Michx. f.) G. Don	shellbark hickory (Eng.); caryer lacinié (Fr.) 	Used for arthritis [91].
Juglandaceae, Tree		
Carya ovata (Mill.) K. Koch	shagbark hickory (Eng.); caryer ovale, noyer tendre (Fr.)	Used for arthritis [91]. 
Syn: Hicoria alba Britton		Shoots: Fresh shoots placed on hot stones and fumes inhaled in convulsions [Ojibwa: 47].
Juglandaceae, Tree		
Castilleja coccinea (L.) Spreng.	scarlet paintbrush, Indian paintbrush (Eng.); castilléjie écarlate (Fr.); wĭnabojo'noko'mĭs wi'nĭzĭsûn' (Ojibwa)	Used in "women diseases" [Ojibwa: 47].
Scrophulariaceae, Herb		Flowers: Decoction used in rheumatism [Ojibwa: 47]. 
Castilleja miniata Dougl. Ex Hook.	great red paintbrush, Indian paintbrush, painted-cup (Eng.); castilléjie rougeâtre (Fr.)	Flowers: Dried heads added to wild chamomile flowers to make a tea to cure headaches and relax nerves [Metis: 13]. 
Scrophulariaceae, Herb		
Caulophyllum thalictroides (L.) Michx.	blue cohosh (Eng.); caulophylle faux-pigamon (Fr.); iskwawutupe (Cree); be'cigodji'bigûk, oci'gîmîc (Ojibwa)	Used in cramps [Ojibwa: 47].
Berberidaceae, Herb		Rhizomes: Powdered and used in uterine troubles, especially dysmenorrhea, metrorrhagia and post partum hemorrhage [Cree: 74]. Infusion given to render delivery rapid and painless. Used for rheumatism, dropsy, uterine inflammation, and colic [44].
		Roots: Infusion used in amenorrhea [Cree: 74] or for painful menstruation [Ojibwa: 87]. Tea used as an emetic [Ojibwa: 87]. Decoction used in lung troubles. Mixed with Rudbeckia laciniata in a decoction taken in indigestion. Mixed with Sanguinaria canadensis in a decoction taken to treat stomach cramps. Scraped finely, tied in a cloth, squeezed in warm water taken as an emetic [Ojibwa: 47].
		Flowers: Infusion used for rheumatism and sciatica [Cree: 74].
Ceanothus americanus L.	New Jersey tea (Eng.); céanothus d'Amérique (Fr.); kadegimnedu, konjibik (Ojibwa)	Roots: Steeped and infusion drunk to cure constipation, bloating and shortness of breath. Mixed with roots or branches of wild grape, roots of Hepatica, bark of beech, and inner bark of sugar maple, black birch and red-osier dogwood, all steeped together to make a remedy for pulmonary troubles [Ojibwa: 85]. 
Rhamnaceae, Shrub		
Ceanothus herbaceus Raf.	New Jersey tea (Eng.); céanothus à feuilles ovées (Fr.); odiga'dimanido' (Ojibwa)	Used in lung troubles and as an emetic [Ojibwa: 47].
Syn.: C. ovatus auct. non Desf.		Roots: Decoction taken in cough [Ojibwa: 47].
Rhamnaceae, Shrub		
Celastrus scandens L.	bitter-sweet (Eng.); célastre grimpant, bourreau des arbres (Fr.); bima'kwûd, manîdobima'kwit (Ojibwa)	Medicinal plant [Ojibwa: 86]. 
Celastraceae, Vine		Roots: Cooked in animal fat, strained, and used as an ointment for cancer or obstinate sore [Chippewa: 85; Ojibwa: 87]. Decoction used to treat stoppage of urine [Chippewa: 47], or as a physic or diuretic. 
		Fruits: Used for sotmach troubles [Ojibwa: 87].
		Stalk: Decoction used in skin eruptions [Ojibwa: 87]. 
Cetraria islandica (L.) Ach.	lichen (Eng.); lichen d'Islande (Fr.)	Boiled and taken to treat tuberculosis [Dene: 98]. 
Parmeliaceae, Lichens		
Chamaecyparis thyoides (L.) BSP	white cedar (Eng.); cèdre blanc de l'Atlantique (Fr.); gī'zhik (Ojibwa)	Leaves: Cushed and applied to relieve headache, boiled and inhaled to cure backache [Ojibwa: 84]. 
Syn.: Cupressus thyoides L.		
Cupressaceae, Tree		
Chamaedaphne calyculata (L.) Moench	leatherleaf (Eng.); faux bleuet, cassandre caliculé (Fr.); matshikîsha (Montagnais)	Bark or twigs: Steeped into water and used as a compress or tea for headache [Montagnais: 71].
Syn.: Cassandra calyculata (L.) D. Don.		
Ericaceae, Shrub		
Chamerion angustifolium (L.) Holub ssp. angustifolium	fireweed, willow herb (Eng.); épilobe à feuilles étroites, bouquets rouges (Fr.); hapaskwa, askapask, athkāpask, ākāpuskwah, liy(h)kāpusk (Cree); oja'cidji'bĭk (Ojibwa); kapamastak (Atikamekw); tlitl'echi (Dene); góndhi'elé (Chipewyan)	Applied to treat cuts [Algonquin: 75] or used in cough [Abenaki: 67].Young tops eaten to "strengthen the blood" [Metis: 13]. Tea used to relieve a sore stomach [Dene: 101]. 
Syn.: Epilobium angustifolium L.		Whole plant: Tea taken to treat intestinal worms [Dene: 13; Chipewyan: 92]. Boiled and the liquid rubbed on the skin to ease rashes [Dene: 99].
Onagraceae, Herb		Leaves: Chewed and applied as a plaster on bruises [Metis: 13; Cree: 95]. Poultice from fresh or dried leaves applied to bruises [Chippewa: 47], burns, bee stings, aches and swelling caused by arthritis [Dene: 99]. Chewed and applied to bee stings and bites [Dene: 100].
		Roots: Roasted in ashes, mashed, and applied to boils [Algonquin: 68]. Peeled, chewed or pounded, and applied as a poultice on boils, carbuncle, abscesses or open wounds to prevent infection [Metis: 13; Cree: 95; Ojibwa: 87]. Boiled and used for skin problems [Atikamekw: 73]. Herbal water taken to induce menses [Cree: 93].

Chamerion latifolium (L.) Holub Syn.: Epilobium latifolium L.	river beauty, dwarf fireweed (Eng.); épilobe à feuilles larges (Fr.); tlitl'echi (Dene)	Tea used to relieve a sore stomach [Dene: 101]. 
Onagraceae, Herb		Leaves: Chewed and applied to bee stings and bites [Dene: 100].

Chelone glabra L.	white turtle head (Eng.); tête de tortue, galane glâbre (Fr.); athozis wiwsnia'ginol (Malecite)	Steeped and given to prevent pregnancy [Malecite: 65]. 
Scrophulariaceae, Herb		Roots: Used with cedar bark to prepare a medicinal tea [Algonquin: 69].
*Chenopodium album L.	lamb's quarters (Eng.); chénopode blanc, chou gras (Fr.); wīthiniwpakwātik (Cree)	Leaves: Dipped in maple or birch sap and used to treat cold [55]. Decoction taken or applied to treat painful limbs [Cree: 95].
Chenopodiaceae, Herb		
*Chenopodium ambrosioides L.	American wormseed (Eng.); chénopode fausse-ambroisie (Fr.)	Whole plant: Infusion taken to relieve painful menstruation [44].
Chenopodiaceae, Herb		
Chimaphila umbellata (L.) W. Bartram	prince's pine, pipsissewa (Eng.); chimaphile à ombelles, herbe à peigne (Fr.); amiskwāthōwipak (Cree); k'agegiga'kil (Malecite); yaskopteg, ga'gîge'bûg (Ojibwa); jabak (Abenaki)	Mixed with other species to make a remedy for gonorrhoea and ulcers. Steeped and applied to blisters [Ojibwa: 85]. Applied to open sores and ingested as a tonic and diuretic [44]. Used as an ingredient in a decoction to treat backache or stabbing pain in the chest. Tea or decoction used in blood coughing [Cree: 95]. Steeped with common Juniper and taken in consumption. Steeped and taken to purify blood [Malecite: 65]. Used as a medicine for head colds [Abenaki: 67]. Used in tuberculosis and as a general stomach medicine [Mi'kmaq: 62; Ojibwa: 87]. Boiled and drunk to induce sweating [Algonquians: 63].
Pyrolaceae, Herb		Roots: Decoction used to treat sore eyes [Ojibwa: 47]. Steeped with Conioselium chinense, Tsuga canadensis, and Rumex crispus and given in bladder problems [Mi'kmaq: 62].
Cicuta douglasii (DC.) J.M. Coult. & Rose	Douglas' water-hemlock, western water-hemlock (Eng.); cicutaire pourpre (Fr.)	Roots: Smoked to cure headache [Dene: 98].
Apiaceae, Herb		
Cicuta maculata L.	waterhemlock (Eng.); cicutaire maculée, carotte à Moreau (Fr.); maciskatask (Cree); apagwasî'gons (Ojibwa)	Roots: Medicinal [Ojibwa: 87]. Dried and powdered to make a liniment applied externally [Cree: 95]. 
Apiaceae, Herb		
*Cirsium arvense (L.) Scop.	Canada thistle (Eng.); chardon des champs (Fr.); kaminakuse, kaweminukuse (Cree); masa'nûck (Ojibwa); kon'hizak (Abenaki)	Boiled for consumption [Algonquians: 63]. Tonic, diuretic and astringent [Chippewa: 47]. Used as a bowel tonic [Ojibwa: 87] or as a vermifuge for children [Abenaki: 67]. Used to reduce itching, particularly that caused by Rhus radicans (poison ivy) [Algonquin: 68].
Asteraceae, Herb		Roots: Fleshy white root dried, powdered, and mixed with warm animal grease as a poultice to be applied to aching joints [Metis: 13]. 
Cirsium discolor (Muhl. ex Willd.) Spreng.	common thistle (Eng.); chardon discolore (Fr.); kee-poo-cus-i-cun (Cree)	Dried, powdered and mixed with water to make a paste applied to wounds [Cree: 76].
Asteraceae, Herb		
Cirsium sp.	thistle (Eng.); chardon (Fr.); ma'zana'tĭg (Ojibwa)	Roots: Mixed with Populus balsamifera in a decoction taken internally to treat "female weakness" and back pain. Steeped with Taraxacum officinale and taken in confinement [Ojibwa: 47]. 
Asteraceae, Herb		
*Cirsium vulgare (Savi) Ten.	common thistle (Eng.); chardon vulgaire, piqueux (Fr.); ji'masa'nûck (Ojibwa)	Roots: Used for alleviating stomach cramps [Ojibwa: 87].
Syn.: C. lanceolatum (L.) Hill		
Asteraceae, Herb		
Cladina stellaris (Opiz) Brodo	reindeer lichen (Eng.); lichen à caribou, mousse à caribou (Fr.); wāpiskastaskamihk, atikōmīciwin (Cree)	Powdered and mixed with water to expel intestinal worms [Cree: 95].
Syn.: C. alpestris (L.) Rabenh.; Cladonia stellaris (Opiz) Pouzar & Vezda		
Cladoniaceae, Lichen		
Cladina rangiferina (L.) Nyl.	greygreen reindeer lichen (Eng.); lichen à caribou, mousse à caribou (Fr.); whapskumuk, epshatuk (Cree)	Used to treat diabetes [Cree: 82]. 
Cladoniaceae, Lichen		
Clintonia borealis (Aiton) Raf.	corn-lily, bluebead lily (Eng.); clintonie boréale (Fr.); gînose'wîbûg (Ojibwa); sestedomanuk, skaskataminask (Atikamekw) tshîtshue atâpukuat (Montagnais)	Pounded and applied to face and hands as a mosquito repellent [Atikamekw: 73]. Used to activate labour for childbirth [Ojibway: 73]. 
Liliaceae, Herb		Leaves: Poultice used in infections and open wounds [Algonquin: 69; Atikamekw: 73]. Boiled before being applied to swelling and hemorroids [Montagnais: 71]. Applied to burns. Decoction applied to treat scrofula [Ojibwa: 47].
		Roots: Tea used to help parturition. Put on a dog bite to prevent infection [Ojibwa: 87]. 

Clintonia uniflora (Menzies ex Schult. & Schult. f.) Kunth	single-flowered clintonia, Queens cup, bride's bonnet (Eng.); clintonie uniflore (Fr.)	Roots: Juice drunk in gravel [Algonquians: 63].
Syn.: Smilacina borealis (Aiton) Raf.		
Liliaceae, Herb		
Comarum palustre L.	marsh five-finger (Eng.); potentille palustre (Fr.); beba'akwûndek, bĭne'bûg (Ojibwa)	Plant used to cure stomach cramps [Ojibwa: 87]. 
Syn.: Potentilla palustris (L.) Scop.		Roots: Decoction used to treat dysentery [Ojibwa: 47].
Rosaceae, Herb		
Comptonia peregrina (L.) J.M. Coult.	sweet fern, ant wood (Eng.); comptonie voyageuse (Fr.); kba'agne-mins (Chippewa ); eninigsomo'zil (Malecite); kba'agne-minš, gibaime'nûna'gwûs (Ojibwa)	Used for catarrh. Steeped with yarrow and applied to sprain swelling [Malecite: 65]. Used to treat eczema, sores, cancer and poison ivy rash [Mi'kmaq: 61]. 
Syn.: Myrica asplenifolia L.		Leaves: Steeped and rubbed on the skin to cure poison ivy rash [Mi'kmaq: 60; Algonquians: 63]. Steeped with leaves of catnip (Nepeta calaria) to make an infusion to be used as a febrifuge [Chippewa: 85]. Tea used to make to cure the flux and stomach cramps [Ojibwa: 87]. Steeped and tea taken as a general tonic. Poultice used for rheumatism and external sores [Mi'kmaq: 62]. Crushed and the perfume inhaled or drunk as a tea for headache [Algonquin: 69].
Myricaceae, Shrub		
Conioselinum chinense (L.) Britton, Sterns & Poggenb.	Chinese hemlockparsley (Eng.); coniosélinum de Genesee (Fr.)	Roots: Steeped with Tsuga canadensis, Chimaphila umbellata and Rumex crispus and given in bladder problems [Mi'kmaq: 62].
Apiaceae, Herb		
Coptis trifolia (L.) Salisb.	golden thread (Eng.); coptide du Groenland, savoyane (Fr.); wizauke'skil (Malecite); wi'ca'uckomuk, uîshakâshkamuku (Montagnais/Innu); wijô'wapap'kôs (Abenaki); osawskamikwapi (Atikamekw); wesa wa'nikwe'ak , oza'widji'bĭg (Ojibwa)	Steeped, used to saturate a rag to be placed in sore mouth [Mi'kmaq: 61; Malecite: 65]. Used to treat frostbite or to stimulate appetite [Algonquin: 68].
Syn.: C. groenlandica (Oeder) Fernald		Stem: Tea used as a wash for sore eyes, lips and interior of mouth [Montaganais: 70]. Chewed to allay canker or sores on the gums or in the mouth. Used to ease mouths irritated by excessive tobacco smoking [Algonquians: 63].
Ranunculaceae, Herb		Roots: Used for sore eyes or steeped to make a stomach medicine [Mi'kmaq: 62]. Tea used for heart disease, toothache, diarrhoea and as an eyewash [Algonquin: 69; Atikamekw: 73]. Used for cough [Abenaki: 67; Atikamekw: 73]. Decoction used to soothe teething pain and heal gums, and as a mouth wash to treat sore mouth [Ojibwa: 87]. Decoction used for throat pain, cough and mouth infection [Montagnais: 71].
Cornus alternifolia L. f.	dogwood (Eng.); cornouiller à feuilles alternes (Fr.); muns-mins, moso'mîc, muj'omĭj' (Ojibwa)	Bark: Used as an eye bath [Chippewa: 85]. Decoction used as an emetic, in cough and fever [44]. 
Cornaceae, Tree		Inner bark: Used as an emetic [Ojibwa: 87]. 
		Roots: Alone or mixed with Cornus sericea and Alnus incana in a decoction used as a wash or compress to treat sore eyes [Ojibwa: 47]. 
Cornus canadensis L.	bunch berry, dogwood, dwarf cornel, pigeonberry (Eng.); cornouiller du Canada, quatre-temps, rougets (Fr.); ode'imînîdji'bîk (Ojibwa); patkéna'houk (Abenaki); saguminan (Atikamekw); shâshâkuminânakashî (Montagnais); nekutsahemen (Innu)	Medicinal plant [Innu: 72].Used to heal sores and cancers [Mi'kmaq: 61]. Steeped and used for paralysis [Algonquians: 63]. Boiled with Gaultheria procumbens and used for cold or mixed with Taxus canadensis twigs and used against menstrual disorders [Atikamekw: 73]. Decoction used for "stich in the side" [Abenaki: 67]. Steeped and the liquid drunk in kidney problems [Mi'kmaq: 62]. 
Cornaceae, Shrub		Whole plant: Boiled and liquid drunk for rheumatism and other types of pain [Montagnais: 71]. 
		Leaves: Used to prepare cathartic tea [Algonquin: 69]. 
		Roots, leaves and fruits: Steeped and given against fits [Malecite: 65]. 
		Roots: Tea used to cure colics [Ojibwa: 87]. 
Cornus florida L.	flowering dogwood (Eng.); cornouiller fleuri (Fr.); nemwatik (Chippewa)	Used for fever and cold [44]. 
Cornaceae, Tree		Inner bark: Mixed with other plants (Sanguinaria, Asarum and Ostrya) to make a cough remedy [Chippewa: 85]. 
Cornus foemina Mill.	stiff dogwood (Eng.)	Bark: Dried and mixed with tobacco for smoking [Algonquians: 63].
Syn.: C. stricta Lam.		
Cornaceae, Shrub		
Cornus racemosa Lam.	panicled dogwood (Eng.); cornouiller à grappes (Fr.); meskwabi'mîc (Ojibwa)	Bark: Tea used for flux. Inserted into the anus as a treatment for piles [Ojibwa: 87].
Syn.: C. paniculata L'Hér.		
Cornaceae, Shrub		
Cornus sericea L.	red-osier dogwood, red willow (Eng.); cornouiller stolonifère, hart rouge (Fr.); mehkwa pemakwa, mikwapamuk, mīhkwa pēmakwa, mīkōbīmāka, mikwanbimaka, mikwapimakwah, mithkwāpīmak, miskwāpīmak, mi(h)kwapiymak, mikwa piskaw, nipsiy wasaskwetow, pīmīhkwāhtik, mīhkwanīpisīya, mikobimuk (Cree); k'áik'ozé (Chipewyan); meskwabi-mins, mĭs'kwabi'mĭc (Ojibwa); nespipam'k' (Malecite); mamkawa'kousek (Abenaki); mîkuâpemuku (Montagnais)	Medicinal plant [Chippewa: 86]. Chewed and placed on fresh cuts to stop bleeding [Mi'kmaq: 43]. Steeped and used for diarrhoea or to make a wash to cure eruptions caused by poison ivy or by other poisons [Chippewa: 85]. Chewed and applied to sore eyes. Steeped and used as a gargle in sore throat. Used in catarrh [Malecite: 65].
Syn.: C. stolonifera Michx		Bark: Decoction from young bark used as an emetic in cold, cough and fever [Cree: 42]. Peeled, mixed with another plant, boiled, and a cloth soaked in the solution is applied to sore eyes [Cree: 13]. Applied to wounds to stop bleeding or drunk as a tea for cold [Algonquin: 69]. Smoked [Ojibwa: 86]. Infusion used to treat eye problems [Abenaki: 67]. Boiled and used in a mixture with barks of poplar, birch and spruce to treat cough and cold [Dene: 17]. Herbal water taken for diarrhoea and to induce vomiting [Cree: 93].
Cornaceae, Shrub		Stems: Tea taken for chest trouble and to cure stoppage of urine [Dene: 13; Chipewyan: 92].
		Roots: Tea drunk to treat dizziness [Dene: 13; Chipewyan: 92] or stomach problems [Cree: 96]. Mixed with other herbs in a decoction given to children to stop diarrhoea [Cree: 13]. Mixed with Cornus alternifolia and Alnus incana in a decoction used as a wash or compress to treat sore eyes [Ojibwa: 47]. Scraped and mixed with Aralia racemosa and smoked to treat headache [Malecite: 65]. Used to treat aching muscles and soreness [Dene: 17]. 
		Fruits: Boiled and taken to treat tuberculosis [Dene: 98]. 
		Fruits or pith: Used to make a wash to treat snow blindness [Cree: 95]. 
		Pith: Used in cataracts [Cree: 95]. 
		Bark and twigs: Decoction used for skin or eye problems [Montagnais: 71].
		Leaves: Crushed and used to treat burns, bee stings and insect bites [Dene: 100]. 

Cornus sp.	willow, dogwood (Eng.); cornouiller (Fr.)	Bark: Minced, boiled and applied as a poultice in sprains [Algonquin: 75].
Cornaceae, Shrub		
Corydalis aurea Willd.	golden corydalis (Eng.); corydale dorée (Fr.); tîpotîe'kwason (Ojibwa)	Roots: Placed on coals and smoke inhaled to clear the head and as a tonic [Ojibwa: 87]. 
Fumariaceae, Herb		
Corylus americana Walt.	American hazelnut (Eng.); noisetier d'Amérique (Fr.); mûkwobaga'nak (Ojibwa)	Bark: Boiled and used as a poultice to heal cuts [Ojibwa: 87]. 
Betulaceae, Shrub		Stalk: Burned and charcoal combined with bear gall pricked into the temples with needles to treat convulsions [Ojibwa: 47]. 
Corylus cornuta Marsh.	beaked hazelnut (Eng.); noisetier à long bec (Fr.); bagan', baga'nak (Ojibwa); pakanatuk (Atikamekw)	Hairs of the husk used to expel worms [Ojibwa: 87].
Syn : C. rostrata Ait.		Branches and leaves: Tea used in heart trouble and intestinal disorders [Atikamekw: 73; Algonquin: 69]. 
Betulaceae, Tree		
Crataegus sp.	hawthorn (Eng.); aubépine (Fr.); minesgan-wins, mînesaga'wûnj (Chippewa)	Bark: Medicinal [Chippewa: 85, 87]. 
Rosaceae, Tree		Roots: Medicinal [Chippewa: 85, 87]. Mixed with other plants in a decoction given to treat "female weakness" and back pain [Ojibwa: 47]. 
*Cucurbita maxima Duchesne	squash (Eng.); courge (Fr.); ogwîssi'maun o'wasokwûne'k (Ojibwa)	Seeds: Tea drunk as a diuretic [Ojibwa: 87].
Cucurbitaceae, Vine		
Cynoglossum virginianum L. var. boreale (Fernald) Cooperr.	hound's tongue (Eng.); cynoglosse boréal (Fr.); masa'n (Ojibwa) 	Smoked to cure headache [Ojibwa: 87]. 
Syn.: C. boreale Fernald		
Boraginaceae, Herb		
Cypripedium acaule Aiton	lady'slipper, moccasin flower, nerve root (Eng.); cypripède acaule, sabot de la vierge (Fr.); kamidjetotapi (Atikamekw); ago'biso'wĭn (Ojibwa)	Roots: Steeped and used for nervousness [Algonquians: 63; Mi'kmaq: 60]. Used in venereal disease and menstrual disorders [Algonquin: 69]. Boiled and used against stomachache, urinary tract disorders and kidney problems for children [Atikamekw: 73]. Powdered, moistened and used to treat toothache. Steeped and taken in indigestion. Poultice applied to skin inflammation [Chippewa: 47].
Orchidaceae, Herb		Flowers: Powdered, moistened and used to treat toothache [Chippewa: 88]. 
Cypripedium parviflorum Salisb.	ladyslipper (Eng.); cypripède jaune (Fr.); ma'kasîn (Ojibwa)	Rhizomes: Used as a sedative, antispasmodic or depressant [Cree: 74]. 
Orchidaceae, Herb		Roots: Used for "female troubles" [Ojibwa: 87]. 
Cypripedium reginae Walter	showy lady's slipper (Eng.); cypripède royal (Fr.)	Roots: Used as a sedative in nervous disorders [Penosbcot: 44]. 
Orchidaceae, Herb		
Dactylorhiza viridis (L.) R.M. Bateman, A.M. Pridgeon & M.W. Chase	rein orchis (Eng.); habénaire à longues bractées (Fr.); goko'cgûnda mînêskwe'mîn (Ojibwa)	Aphrodisiac [Ojibwa: 87]. 
Syn.: Habenaria bracteata (Muhl. ex Willd.) R. Br.		
Orchidaceae, Herb		
Dalea purpurea Vent.	purple prairie-clover (Eng.); dalée violette (Fr.); ba'sibûgûk' (Ojibwa)	Leaves and flowers: Decoction taken for heart trouble [Ojibwa: 47]. 
Syn.: Petalostemon purpureus (Vent.) Rydb.		
Fabaceae, Herb		
Dasiphora fruticosa (L.) Rydb. ssp. floribunda (Pursh) Kartesz Syn.: Potentilla fruticosa auct. non L.	shrubby cinquefoil (Eng.); potentille frutescente (Fr.)	Whole plant: Decoction taken as a tea to treat fever [Dene: 98]. 
Rosaceae, Shrub		
Delphinium glaucum S. Watson	tall larkspur (Eng.); pied-d'alouette glauque (Fr.)	Whole plant: Tea used to wash hair and kill lice [Dene: 100].
Ranunculaceae, Herb		
Diervilla lonicera Mill.	bush honeysuckle (Eng.); dièreville chèvrefeuille, herbe bleue (Fr.); wežauškwagmik, osawa'skanet (Ojibwa); maskōcīpihk (Cree); asasunatuk (Atikamekw)	Bark: Infusion used as an eye wash and against constipation [Ojibwa: 85]. 
Caprifoliaceae, Shrub		Roots or stem: Infusion or decoction cooled and applied to sore eyes [Cree: 95]. 
		Roots: Tea used to induce lactation at the time of childbirth [Cree: 95]. Mixed with other plants and used for urinary problems [Ojibwa: 87]. 
		Leaves: Diuretic when used with Cornus canadensis [Atikamekw: 73]. Decoction taken in stomach pain [Ojibwa: 47].
Dirca palustris L.	moosewood, leatherwood, wicopy, rope-bark (Eng.); dirca des marais, bois de plomb (Fr.); djibe'gûb (Ojibwa)	Roots: Steeped to make a drink for pulmonary troubles [Ojibwa: 85]. Mixed with Artemisia dracunculus in a decoction used as a hair ointment [Ojibwa: 47].
Thymelaceae, Shrub		Bark: Tea used as a diuretic [Ojibwa: 87]. 
		Inner bark: Tea used as a laxative [Algonquin: 69]. 
		Stalk: Dreid, pulverized and steeped in water and taken as a physic; green stalk chewed as a physic [Ojibwa: 47]. 
Dryopteris carthusiana (Vill.) H. P. Fuchs	spinulose shield fern (Eng.); dryoptère spinuleuse (Fr.); ku(h)kuguwpuk (Cree)	Frond: Mixed with other plants in a decoction drunk for kidney pain. A different mix is used as a wash for skin diseases, and yet another mix is smoked to treat insanity [Dene: 13].
Dryopteridaceae, Herb		
Dryopteris expansa (C. Presl) Fraser-Jenkins & Jermy	spreading wood fern (Eng.); dryoptère dressée (Fr.)	Young shoots: Boiled and eaten to stimulate appetite [Cree: 93].
Dryopteridaceae, Herb		Roots: Cancer medicine [Cree: 93].
Dryopteris marginalis (L.) A. Gray	marginal shield fern (Eng.); dryoptère à sores marginaux, dryoptéride marginale (Fr.)	Rhizomes: Infusion drunk as a vermifugal [Cree: 74]. 
Dryopteridaceae, Herb		
Dryopteris sp.	fern (Eng.); dryoptère, dryoptéride (Fr.); uîshakâtshâkuat (Montagnais)	Leaves: Dried, steeped into hot water and applied to swells and hemorroids [Montagnais: 71]. 
Dryopteridaceae, Herb		
Echinocystis lobata (Michx.) Torr. & A. Gray	wild balsam-apple (Eng.); échinocystis lobé, concombre sauvage (Fr.); nîgîtîni'gûnûk (Ojibwa)	Roots: Tea used as a tonic and as a bitter medicine for stomach troubles [Ojibwa: 87].
Cucurbitaceae, Vine		
Echinodontium tinctorium (Ellis & Ev.) Ellis & Ev.	Indian paint fungus (Eng.); meah-kis-igun (Cree)	Powdered and mixed with water to make a paste applied to wounds or given internally as an emetic [Cree: 76].
Echinodontiaceae, Fungi		
Empetrum nigrum L.	crowberry, curlewberry (Eng.); camarine noire, graines noires (Fr.); askīmināsiht, ebshjimend (Cree); dineech'ùh (Dene)	Whole plant: Tea drunk for diarrhoea [Dene: 100].
Empetraceae, Shrub		Berries: Used to treat diabetes [Cree: 82]. 
		Roots: Mixed with other plants in a decoction drunk to treat cough [Dene: 13; Chipewyan: 92]. 
		Twigs: Used as a diuretic [Cree: 95]. Boiled with spruce cones and tea applied to sores, or drunk to cure mouth infections and sore throats [Dene: 101].
		Roots, berries and stems: Tea drunk for stomach ache and cold [Dene: 99].
		Branches and roots: Boiled and tea drunk to cure mouth infections [Dene: 101].
		Branches and berries: Boiled and tea drunk to ease menstrual pain, pain related to child birth, and to cure mouth infections. Also applied to rashes [Dene: 101]. 
Epigaea repens L.	trailing arbutus, mayflower (Eng.); épigée rampante, fleur de mai (Fr.)	Leaves: Tea drunk for kidney disorders [Algonquin: 69].
Ericaceae, Shrub		
Equisetum arvense L.	horsetail (Eng.); prêle des champs, queue de renard (Fr.); mistatimosoy, okotāwask, enskowusk, kiychiwiykusk (Cree); jasibonskok, gîji'bînûsk (Ojibwa); kheh dyè' (Dene)	Tea used to treat kidney problems, bladder infections or urinary track problems [Dene: 100].
Equisetaceae, Herb		Whole plant: Tea used to cure dropsy [Ojibwa: 87]. 
		Above-ground fertile shoots: Decoction used as a diuretic or in kidney troubles [Cree: 95]. 
