		Inner bark: Used in diabetes [Cree: 77]. Softened in water and used as a poultice on wounds [Metis: 13; Cree: 42].
		Twigs/stem: Tea given to ease bladder pain [Montagnais: 71]. Steeped and used in hair wash or taken as a tonic [Malecite: 65]. Stem debarked and used to make a tea to treat diarrhoea [Metis: 13]. Decoction of a barked procumbent stem or branch used to treat diarrhoea and sore chest. Mixed with other plants to make decoctions to treat "women troubles", teething pain, sickness after childbirth, fever, and cough [Cree: 95]. 
		Twigs and leaves: Boiled to make a drink for asthma [Chippewa: 85]. Used to treat diabetes [Cree: 82]. Boiled and steamed to hasten release of the placenta [Dene: 101]. 
		Cones: Green cones boiled to make a diuretic remedy for kidney trouble. Can be smoked in a pipe to treat asthma [Metis: 13]. Berry-like cones eaten as a cure-all medicine [Chipewyan: 92].
		Gum: Applied to wounds. Mixed with brandy and skunk cabbage and taken in tuberculosis. Applied to sprains, and to relieve soreness and pain [Mi'kmaq: 43].

Juniperus horizontalis Moench.	creeping juniper, rocky mountain juniper (Eng.); genévrier horizontal (Fr.); ahaseminanatik, masekesh, masikeskatik (Cree)	Stems: Boiled with other plants to make a tea for treating cold and teething, and for use as a general system cleaner [Cree: 13]. 
Cupressaceae, Shrub		Leaves: Burned and the smoke inhaled to clear sinuses plugged by a head cold [Metis: 13].
		Berries: Used for back pain, boiled and taken in urinary tract problems [Cree: 81]. Tea drunk to ease back pain [Dene: 101]. 
		Branches: Boiled and steamed to hasten release of the placenta [Dene: 101]. 

Juniperus virginiana L.	red cedar (Eng.); genévrier de Virginie (Fr.); miskwa'wak (Ojibwa)	Leaves and twigs: Used as a diuretic [Cree: 42]. 
Cupressaceae, Tree		Leaves and fruits: Bruised and used internally to treat headache [Ojibwa: 84]. 
		Twigs: Boiled with little twigs of Taxux canadensis and taken internally to treat rheumatism [Ojibwa: 47].
Kalmia angustifolia L.	lambkill, sheep laurel, (Eng.); kalmia à feuilles étroites, crevard de moutons (Fr.); mikwëwa'lwql (Malecite); wesajebo (Atikamekw); jabak (Abenaki); uschipikwh (Cree); uishetshipuk, uîshatshipukua (Innu)	Steeped in hot water and soaked in a woolen pad or rubbed on the limbs or body to relieve pain and stiffness [Montagnais: 70]. Used for head colds [Abenaki: 67]. Tea used for cold and as a tonic [Innu: 72]. Mixed with Sorbus americana in a compress used on cuts and wounds [Innu: 72]. 
Ericaceae, Shrub		Bark: Tea used as an emetic [Algonquin: 75]. Steeped and used externally for rheumatism, sore legs and feet [Mi'kmaq: 62].
		Leaves: Although the leaves are known to be poisonous, a very small quantity can be steeped and drunk for cold, headache and backache. A hot water infusion (very poisonous if very strong) can also be drunk for stomach pain. Poultice applied to head to cure headache [Atikamekw: 73; Algonquians: 63]. Used in diabetes [Cree: 77; 83]. Singed by fire, crushed and used in colds [Algonquin: 69]. Salve prepared from fresh parts and applied to swelling or sprain [Malecite: 65]. Tea used for throat pain [Montagnais: 71]. Applied to swells, arthritis or knee pain [Montagnais: 71]. Used to treat diabetes [Cree: 82].
		Twigs, leaves and flowers: Used in bowel complaints and as a tonic [Cree: 42]. 
		Twigs: Used to prepare a decoction for throat pain and mouth infections [Montagnais: 71].
		Roots: Used to treat diabetes [Cree: 82].
Kalmia latifolia L.	mountain laurel (Eng.); kalmia à feuilles larges (Fr.)	Used in diarrhoea [Cree: 42].
Ericaceae, Tree		
Kalmia polifolia Wangenh.	pale bog laurel (Eng.); kalmia à feuilles d'andromède (Fr.); nágodhts'ëlé (Chipewyan)	Leaves: Chewed or drunk as tea to treat diarrhoea [Chipewyan: 92].
Ericaceae, Shrub		
Lactuca biennis (Moench) Fernald	tall lettuce, blue lettuce (Eng.); laitue bisannuelle (Fr.); dadoca'bo (Ojibwa)	Tea from plant given to women with caked breasts to induce lactation [Ojibwa: 87].
Syn.: L. spicata (Lam.) Hitchc.		
Asteraceae, Herb		
Lactuca canadensis L.	wild lettuce, Canada lettuce (Eng.); laitue du Canada (Fr.); odjici'gomĭn (Ojibwa)	Juice used in skin warts [Chippewa: 47].
Asteraceae, Herb		
Laportea canadensis (L.) Weddell	wood nettle, Canada nettle (Eng.); laportéa du Canada, ortie du Canada (Fr.); masa'natîk (Ojibwa)	Roots: Tea used as a diuretic [Ojibwa: 87]. 
Urticaceae, Herb		
*Lappula squarrosa (Retz.) Dumort.	stickweed (Eng.); bardanette (Fr.); ozaga'tĭgomĕns (Ojibwa)	Roots: Powdered and sniffed or fumes inhaled for headache [Ojibwa: 84]. 
Boraginaceae, Herb		
Larix laricina (Du Roi) K. Koch	tamarack, larch (Eng); mélèze laricin, épinette rouge (Fr.); wakinakum, wakinakun, wakinākin, wāginagun, waachinaakin (Cree); poka'mus (Malecite); mŏsh'kīkiwa'dik, mû'ckîgwa'tîg (Ojibwa); mackigwatuk (Atikamekw); uatshinakan (Innu/Montagnais); oblanda'gasouk, pôbnôdageso (Abenaki); ts'iiteenjùh, diweh (Dene); nídhe (Chipewyan)	Used to stop vomiting [Cree: 95]. Boiled with crowberry and drunk to cure cold [Dene: 101]. Used on boils [Cree: 80].
Pinaceae, Tree		Branches: Decoction used as a diuretic [Algonquians: 63]. Tea used for stomach pain, cold, fatigue, or for general health [Dene: 99]. Tea from fresh branches used to treat stomach problems [Dene: 101].
		Bark: Used in suppurating wounds [Mi'kmaq: 60]. Steeped with alder bark (Alnus incana) to make an infusion for anemia [Chippewa: 85]. Steeped with spruce and fir bark and given in gonorrhoea [Melacite: 65]. Used to make a cough medicine [Abenaki: 67]. Used in chronic bronchitis, in chronic inflammation of the urinary passages and in phases of hemorrage [Ojibwa: 87]. Applied as a compress for eye problems, wounds and swelling [Montagnais: 71]. Boiled, cooled and taken as a cough syrup, for sore throat or mouth. Broth taken for stomach ache [Cree: 81]. 
		Inner bark: Used as a poultice or boiled to make a wash for burns, boils [Dene: 13; Chipewyan: 92], frostbite [Cree: 13], hemorrhoids, infected wounds [Cree, Metis: 13], or cuts [Cree: 13]. Grinded finely, mixed with animal fat and used for skin sores and burns [Cree: 81]. Tea drunk to treat depression, used as an eye wash or for ear irritation [Cree: 13]. Green strips applied to burns and used to make a tea to treat sore threat [Algonquin: 75]. Chopped (fresh or dried) and applied to burns [Ojibwa: 47]. Used in diabetes [Cree: 77, 83]. Boiled and given for sores and swelling [Algonquians: 63]. Chewed raw or boiled and taken to treat sore throat [Cree: 81]. Boiled and tea used to wash a wound. Tea drunk for pain relief, stomach problems, mouth infections, sore throat, fever, cold, flu and bleeding. Boiled with spruce cones and applied to wounds [Dene: 101]. Used to treat diabetes [Cree: 82]. Herbal water taken for heart problems [Cree: 93].
		Needles and inner bark: Used for cough and to prepare poultices for treating infections [Atikamekw: 69; Innu: 72].
		Inner bark and wood: Poultice applied to frostbite and deep cuts [Cree: 95].
		Gum: Chewed to relieve indigestion [Cree: 13]. Used in deep cuts, wounds and burns [Cree: 81]. Applied fresh or boiled on cuts [Cree: 80]. Amber applied to wounds, or boiled and rubbed to cure sore mouth [Cree: 81].
		Sap: Placed in eyes to treat snow blindness [Cree: 80].
		Leaves: Used as inhalant and fumigator [Ojibwa: 87]. Tea used as a laxative [Atikamekw: 73].
		Cones: Used to prepare a decoction for jaundice [Montagnais: 71]. Tea used to soothe cold and relieve headache [Dene: 99].
		Twigs and gum: Used for cough [Montagnais: 71].
		Leaves and bark: Crushed and used in headache [Ojibwa: 84]. 
		Roots and bark: Tea used as a general medicine [Ojibwa: 86]. Mixed with another plant in a decoction drunk daily to treat arthritis, pain, or cold [Cree: 13]. 
		Pulp: Boiled and used to treat impetigo, or used to wash leg sores [Cree: 81]. Wrapped in cloths and placed on burns. Boiled, strained and taken in cough and cold [Cree: 80].
		Wood: Chewed to treat sore throat [Cree: 81]. 
		Bark, boughs and roots: Tea used to treat cold [Dene: 100].
		Roots: Boiled and liquid used to heal wounds [Dene: 98].
Lasallia papulosa (Ach.) Llano	tripes-de-roches (Fr.); uâkuanâpishku (Montagnais)	Tea used for urinary problems [Montagnais: 71]. 
Syn.: Umbilicaria papulosa (Ach.) Nyl.		
Umbilicariaceae, Lichen		
Lathyrus ochroleucus Hook.	creamy vetchling, pale vetchling (Eng.); gesse jaunâtre (Fr.); bûgwa'dj ûk pîni'k mîne'bûg (Ojibwa)	Used for stomach trouble [Ojibwa: 87].
Fabaceae, Vine		
Lathyrus venosus Muhl. ex Willd.	veiny vetchling, wild pea (Eng.); gesse veinée (Fr.); mĭ'nĭsĭno'wûck (Ojibwa)	Roots: Decoction applied to bleeding wounds or taken internally as a tonic and stimulant. Decoction (alone or mixed with roots of Apocynum androsaemifolium) taken internally to treat convulsions [Ojibwa: 47].
Fabaceae, Herb		
Lepidium virginicum L.	wild peppergrass (Eng.); lépidie de Virginie (Fr.)	General medicinal plant [Ojibwa: 86].
 Brassicaceae, Herb		
*Leucanthemum vulgare Lam.	ox-eye daisy (Eng.); chrysanthème leucanthème, marguerite (Fr.); iskwew owehowina (Cree)	Flowers and leaves: Mixed with other plants in a tea that soothes nerves in adults and hyperactivity in children [Metis: 13].
Syn.: Chrysanthemum leucanthemum L.		
Asteraceae, Herb		
Leymus mollis (Trin.) Pilg.	sea limegrass, American dunegrass (Eng.); seigle de mer (Fr.); kawabash (Cree)	Used to treat diabetes [Cree: 82]. 
Poaceae, Herb		
Lilium canadense L.	Canada lily, wild yellow lily (Eng.); lis du Canada (Fr.); walbatweka.'gil (Malecite); wĭnabojo'bikwûk' (Ojibwa)	Roots: Used in stomach disorders [Algonquin: 69]. Given with Viburum lantago in irregular menstruation [Malecite: 65]. Decoction used externally to cure bites of poisonous reptiles [Ojibwa: 47].
Liliaceae, Herb		
Lilium philadelphicum L.	orange-red lily, Philadelphia lily (Eng.); lis de Philadelphie (Fr.); wapayoominusk, wākican, wākiychān (Cree); miškodé-pin, miskode-pin (Ojibwa)	Bulbs: Boiled to make a poultice to be applied to wounds and contusions [Chippewa: 85]. 
Liliaceae, Herb		Mixed with the root of nibnatuguns, boiled and applied as a poultice on the bite of a dog [Chippewa: 85]. Boiled into a soup and taken to treat appendicitis. Tubers sticked into cavities to treat toothache [Cree: 93].
		Roots: Part of a compound medicine used for heart problems [Dene: 13]. Used in stomach disorders [Algonquin: 69]. Grinded, soaked in warm water and applied as a poultice to swelling or bruise. Mixed with staghorn sumach, blackberry root, mountain holly and mountain raspberry root and used in consumption, cough, and fever [Malecite: 65]. 
Limonium carolinianum (Walter) Britton	sea lavender (Eng.); limonium de Caroline (Fr.)	Roots: Grinded and taken with water before each meal for consumption with hemorrhage [Mi'kmaq: 62]. 
Plumbaginaceae, Herb		
*Linaria vulgaris Mill.	butter and eggs (Eng.); linaire vulgaire (Fr.); owacawa'skwûneg (Ojibwa)	Whole plant: Dried and used with other plants in the sweat lodge as a bronchial inhalant [Ojibwa: 87].
Scrophulariaceae, Herb		
Linnaea borealis L.	twin flower (Eng.); linnée boréale (Fr.); pâshpâshtshu (Montagnais)	Paste used to cure inflamation of the limbs [Algonquians: 63]. Tea used to fight chest pain [Montagnais: 71].
Caprifoliaceae, Herb		Whole plant: Tea used in menstrual difficulties, and to ensure good health of pregnant women's babies [Algonquin: 69]. 
Lobelia inflata L.	Indian tobacco (Eng.); lobélie gonflée (Fr.)	Leaves: Dried and smoked as an emetic [44] and for general health [Mi'kmaq: 62]. Smoke blown into ear to treat earache [Mi'kmaq: 60]. 
Campanulaceae, Herb		
Lobelia kalmii L.	Ontario lobelia, Kalm's lobelia (Eng.); lobélie de Kalm (Fr.) 	Used as an emetic [Cree: 42].
Campanulaceae, Herb		
Lonicera canadensis Bartram ex Marsh.	American fly honeysuckle (Eng.); chèvrefeuille du Canada (Fr.)	Vines: Steeped for urinary troubles [Algonquians: 63].
Caprifoliaceae, Shrub		
Lonicera dioica L. Syn.: L. dioica L. var. glaucescens (Rydb.) Butters	glaucous honeysuckle, limber honeysuckle (Eng.); chèvrefeuille dioïque (Fr.); šabankuk (Ojibwa); Sīpāhtik, sīpaminukusīatik, sīpaminitasīatik, sīpāminakasīwā(h)tik, gāganōnskīwaskwah, gagīnawonskiwaskwah, pay(h)payā(h)tik (Cree)	Soaked in water and used to wash hair to make it grow longer [Cree: 13].
Caprifoliaceae, Vine		Stems: Mixed with Cornus sericea and neakmižinš and used as a diuretic [Ojibwa: 85]. Nodes cut off and discarded and the internodes boiled to make a drink taken as a diuretic [Cree: 13]. Decoction used to treat blood clotting after childbirth, and venereal diseases [Cree: 95]. Tea taken in kidney problems [Cree: 96]. Boiled and taken as a diuretic [Dene: 98]. Herbal water taken in heart ailments [Cree: 93].
		Bark: Mixed with other species in an infusion used instead of drinking water in case of dysuria [Ojibwa: 85]. Tea used in menstrual difficulties, to treat kidney stones, or as a cathartic [Algonquin: 69].
		Inner bark: Infusion used as a diuretic [Cree: 95].
		Roots: Decoction used in lung trouble [Ojibwa: 47]. Decoction drunk to treat chronic bladder problems [Cree: 13] or to relieve constipation [Dene: 98].
Lonicera involucrata (Richardson) Banks ex Spreng.	black twinberry; twinflower, honeysuckle (Eng.); chèvrefeuille involucré (Fr.); payipahtik, pipahtikwa (Cree)	Stem: Dried and boiled to make a decoction drunk to treat venereal diseases [Metis: 13].
Caprifoliaceae, Shrub		
Lycoperdon perlatum Pers.	puffball fungus (Eng.); vesse-de-loup perlée (Fr.); wathaman, pesohkan, bībōgīthāmin, bīpōgīthamin, pissoskum, kōkōsiwathaman, kāpwīpocīpathisit, kāpikiy(h)tiypayta (Cree); datsántsíé (Chipewyan) 	To stop bleeding from a cut, the mature puffball can be turned open and the inside surface of the skin, with its adhering cottony mass applied to the wound. Spores may also be squirted from the puffball onto the cut and into the nose to stop nosebleeding [Cree, Dene, Metis: 13; Chipewyan: 92]. Spores can also be used as baby powder to prevent chafing [Dene: 13] or to treat weeping sores or burns [Dene: 98, 100].
Agaricaceae, Fungi		
Lycoperdon sp.	puffball (Eng.); vesse-de-loup (Fr.); kâpîputepishiti (Montagnais)	Spores inhaled to stop nosebleeding [Dene: 101; Montagnais: 71; Cree: 93, 95] or applied to cuts to stop bleeding [Dene: 17] or to relieve skin rash [Dene: 101]. 
Agaricaceae, Fungi		
Lycopodium clavatum L.	stag's horn, common club-moss (Eng.); lycopode claviforme, courants verts (Fr.)	Whole plant: Brewed and used for weakness and fever [Algonquians: 63]. Used in diabetes [Cree: 77, 82]. 
Lycopodiaceae, Herb		Shoots: Used in diabetes [Cree: 83].
Lycopodium dendroideum Michx.	round-branched tree-clubmoss, ground pine, bear paw (Eng.); lycopode dendroïde (Fr.)	General medicinal plant. Boiled and drunk as a purgative in case of biliousness [Algonquians: 63]. Mixed with Diervilla lonicera and used as a diuretic [Ojibwa: 87]. 
Lycopodiaceae, Herb		
Lycopodium obscurum L.	ground pine (Eng.); lycopode foncé (Fr.)	Mixed with twigs of Picea glauca and inner part of wood of Ostrya virginiana and used for steaming stiff joints in rheumatism [Ojibwa: 47]. 
Lycopodiaceae, Herb		
Lycopodium sp.	club-moss, ground pine (Eng.); lycopode (Fr.); pâshitshinâkuana (Montagnais)	Whole plant: Tea for inducing labor and making childbirth easier, also used in treatments of bladder trouble in children [Algonquin: 69]. Weak runnings as antipyretics [Algonquians: 63; Mi'kmaq: 60]. Steeped in hot water with seal oil or lard, along with balsam fir and used as a compress against diarrhoea for children [Montagnais: 71].
Lycopodiaceae, Herb		
Lysichiton americanus Hultén & H. St. John	yellow skunk cabbage (Eng.); lysichiton d'Amérique (Fr.)	Used as a general medicine [Malecite: 59, Mi'kmaq: 62]. Small piece steeped in a cupful of water and taken in diabetes [Mi'kmaq: 62]. 
Syn.: L. camtschatcensis auct. non (L.) Schott		
Araceae, Herb		
Maianthemum canadense Desf.	wild lily-of-the-valley, squirrel berry (Eng.); maïanthème du Canada, petit muguet (Fr.); sōsōwīpukōsak, sōskōpukwagōh (Cree); agongosî'mînûn (Ojibwa)	Used to "keep the kidneys open" during pregnancy, to cure sore throat and headache [Ojibwa: 87]. Tea drunk for headache [Algonquians: 63]. 
Liliaceae, Herb		Leaves: Cleaned and applied directly on a cut as a bandage or a cooled decoction is used to soak a cut. Poultice used to treat swellings of the limbs [Cree: 13].
Maianthemum racemosum (L.) Link ssp. racemosum	false spikenard, false Solomon's seal (Eng.); smilacine à grappes (Fr.); amwiminigak' (Maletice); onkôk'akak, onkôk'skak (Abenaki); kinē'wigwŏshk, agongo'simînûn', cigona'gan (Ojibwa) 	Used in bleeding from the mouth [Abenaki: 67].Tea for sore back [Algonquin: 69]. 
Syn.: Smilacina racemosa (L.) Desf.; Vagnera racemosa (L.) Morong		Roots: Powdered, placed on a hot stone and fomentation applied to painful body parts or fume inhaled to cure headache or catarrh [Chippewa: 85; Ojibwa: 66, 84]. Decoction taken to treat back pain and other diseases in women [Ojibwa: 47]. Mixed with Apocynum androsaemifolium and used to "keep the kidneys open during pregnancy", to cure sore throat and headache [Ojibwa: 87]. 
Liliaceae, Herb		Leaves: Warm decoction used as a bath to ease rash or itch [Maletice: 65; Ojibwa: 84]. Crushed and applied to cuts to stop bleeding [Ojibwa: 84]. 
Maianthemum stellatum (L.) Link	star-flowered solomon's seal (Eng.); smilacine étoilée (Fr.); anungokauh (Ojibwa)	Plants used as a stimulant and system cleanser [Ojibwa: 19]. 
Syn.: Smilacina stellata (L.) Desf.		
Liliaceae, Herb		
Malaxis unifolia Michx.	green Adder's mouth (Eng.); malaxis unifolié (Fr.); aîa'nîkotci'mîn (Ojibwa)	Roots: Used with Diervilla lonicera as a diuretic [Ojibwa: 87]. 
Syn.: Microstylis unifolia (Michx.) BSP		
Orchidaceae, Herb		
*Matricaria discoidea DC.Syn.: Matricaria matricarioides auct. non (Less.) Porter	pineapple weed, chamomile (Eng.); matricaire odorante, herbe à crapaud (Fr.)	Used for kidney problems [Cree: 93]. Tea drunk to treat insomnia or to calm the nerves, can be sweetened with honey and given in a bottle to calm a fretting baby [Metis: 13]. Tea drunk as a relaxant, also given to new mothers to induce milk flow [Dene: 100].
Asteraceae, Herb		Flowers: Used to treat eye infections by squeezing the fresh juice directly into the eye [Cree: 13]. 
Matteuccia struthiopteris (L.) Todaro.	fiddlehead fern, ostrich fern (Eng.); matteucie fougère-à-l'autruche (Fr.); kākākīwīkot (Cree)	Fronds: Base of the frond boiled with other herbs to make a decoction drunk to slow a pounding heart, also used to treat stomach pain [Dene: 13]. Decoction made with the base of the stipe of the sterile frond used for back pain and to speed expulsion ot the afterbirth [Cree: 95]. 
Dryopteridaceae, Herb		Rhizomes: Stipe buds on rhizome used to treat cancer and to help gain weight [Metis: 13]. 
*Medicago sativa L.	alfalfa, lucerne (Eng.); luzerne, lentine (Fr.)	Above-ground parts: Steeped to make a drink for arthritis or ulcers [Cree: 13]. Tea used in stomach problems, arthritis, and muscular pain [Cree: 96].
Fabaceae, Herb		
Melampyrum lineare Desr.	narrow-leaved cow-wheat (Eng.); mélampyre linéaire (Fr.); agongasi'mînûk (Ojibwa)	Whole plant: Tea taken as an eye medicine [Ojibwa: 87]. 
Scrophulariaceae, Herb		
*Melilotus officinalis (L.) Lam.	yellow sweet-clover (Eng.); mélilot jaune, mélilot officinal, trèfle d'odeur jaune (Fr.)	Whole plant: Boiled with barley seeds to make a decoction drunk as a general tonic [Cree: 13]. Tea used as a tonic and blood cleanser [Cree: 96].
Syn.: M. albus Medik.		
Fabaceae, Herb		
Menispermum canadense L.	Canada moonseed (Eng.); ménisperme du Canada (Fr.); bîma'kwît wa'bîgons (Ojibwa)	Rhizomes: Used for scrofula [44]. 
Menispermaceae, Vine		
*Mentha aquatica L.	peppermint (Eng.); menthe poivrée (Fr.)	Used for sore throat and for kidney troubles in combination with beaver castor [Algonquin: 75].
Syn.: M. piperita L.		Leaves: Steeped and used for headache [Algonquians: 63]. 
Lamiaceae, Herb		
Mentha arvensis L.	wild mint (Eng.); mente sauvage, baume (Fr.); amisko wehkuskwa, amiskōwīkask, āmskuwiy(h)kusk, wīkask, wīkaskwah, wakaskwah (Cree); pse'skil (Melatice); name'wûckons (Ojibwa); kaakawakamicik (Atikamekw); kâuîpâpinamânapukâshiti nîpîsha (Montagnais); tsátlh'oghtsëné (Chipewyan) 	Used as a carminative [Chippewa: 85] or to treat stomachache [Cree: 42, Ojibwa: 86]. Steeped and given at frequent intervals to make a child quieter [Malecite: 65]. Tea drunk to favor sleep [Cree, Metis: 13 ], as wash for sores, as a part of compound medicines for treating cancer or diabetes [Metis: 13], to treat cough or cold [Cree, Dene: 13; Dene: 17], fever [Atikamekw: 73; Montagnais: 71; Cree: 13], congestion, chills, menstrual cramps, to soothe teething babies' gums or as a tonic, to treat weariness or fatigue, to treat children diarrhoea, or pain [Cree: 13]. Smelled or boiled and the steam inhaled to clear the nasal passages in cold [Cree: 13]. Tea used to prevent the onset of cold or to cure prolonged cold and coughing up blood [Cree: 95]. 
Syn.: M. canadensis L.		Whole plant: Tea taken as a blood remedy and against fever [Ojibwa: 87]. Tea used to treat stomach disorders and fever [Cree: 96]. 
Lamiaceae, Herb		Above-ground parts: Tea used to treat arthritis, muscular pain, sore throats, cough and cold. Steam inhaled for sore throat, cough and cold. Tea used as "women's medicine" [Cree: 96]. Tea used to treat cough [Chipewyan: 92]. Herbal water used for fever and high blood pressure [Cree: 93].
		Flowers: Ground with yarrow flowers, placed in a cloth, moistened and rubbed on infected gums to remove pus. Crushed with flowers of Achillea millefolium var. occidentalis, wrapped in a cloth and dipped in water to clean pus from the gums of a teething child [Cree: 95]. 
		Leaves or leafy stem: Ground and applied to the gums to relieve toothache [Cree: 95].
		Leafy stem and flowers: Inserted into the nostril to stop nosebleed [Cree: 95].
*Mentha spicata L.	spearmint (Eng.); menthe à épis, baume (Fr.); wekemakowemina (Cree)	Leaves: Infusion given in colic [Cree: 74].
Syn.: M. viridis L.		
Lamiaceae, Herb		
Menyanthes trifoliata L.	buckbean (Eng.); ményanthe trifolié, herbe à canards (Fr.)	Roots: Very strong decoction drunk as a medicine [Algonquians: 63]. 
Menyanthaceae, Herb		
Mertensia paniculata (Aiton) G. Don	lungwort, tall bluebells (Eng.); mertensie paniculée (Fr.); ogu-malask (Cree)	Part of a compound medicine used to treat heart trouble [Metis: 13]. 
Boraginaceae, Herb		
Mirabilis nyctaginea (Michx.) MacMill.	heart-leaved four-o'clock, heart-leaved umbrellawort (Eng.); nyctage parasol (Fr.); goko'coadji'bîk, be'dukadak'igisĭn (Ojibwa)	Roots: Poultice made with a decoction of dried roots or with fresh roots used in sprain or strained muscles [Ojibwa: 47].Used to reduce sprains and swellings [Ojibwa: 87]. 
Syn.: Oxybaphus nyctagineus (Michx.) Sweet; Allionia nyctaginea Michx.		
Nyctaginaceae, Herb		
Mitchella repens L.	two-eyed Berry, creeper partridge-berry (Eng.); mitchella rampant, pain de perdrix (Fr.); papatigwibagassiwil (Abenaki)	Fruits: Used to treat swellings [Abenaki: 67]. Cooked into a jelly and used for fever [Algonquians: 63]. 
Rubiaceae, Herb		
Mitella nuda L.	bishop's cap, naked mitrewort (Eng.); mitrelle nue (Fr.); amiskōcawakayipak, ōcawakāyipak (Cree)	Leaves: Crushed and wrapped in cloth and inserted in the ear to treat earache [Cree: 95]. 
Saxifragaceae, Herb		
Monarda fistulosa L.	wild bergamot, horse mint (Eng.); monarde fistuleuse, menthe de cheval (Fr.); mostoswīkask, kapiskotānāskīhk (Cree); moshkōs'wanowins', weca'wûs wackwî'nek, bibi'gwûnûkûk', wabino'wuck (Ojibwa)	Tops dried and used as a sternutatory for cold relief, or boiled with Eupatorium perfoliatum to make a fomentation to be applied for rheumatism [Chippewa: 85].
Lamiaceae, Herb		Whole plant: Dried, boiled to obtain the volatile oil and inhaled to cure catarrh and bronchial affections [Ojibwa: 87]. Boiled and the decoction drunk by women after childbirth. Mixed with other plants to make a drink for treating menstrual cramps, stomachache, headache and fever [Cree: 13]. Tea used to treat fever, headache, and also used as "women's medicine" [Cree: 96].
		Above-ground parts: Tea used to treat stomach disorders [Cree: 96]. 
		Roots: Decoction used to ease stomach and intestinal pain [Ojibwa: 84]. 
		Roots and flowers: Decoction used against intestinal worms [Ojibwa: 47].
		Flowers and leaves: Steeped and used in skin eruptions and burns [Ojibwa: 47].
		Leaves: Chewed and placed in the nostrils to relieve headache [Chippewa: 85]. 

Monarda punctata L.	spotted beebalm (Eng.); monarde ponctuée (Fr.); ka-bi-sani-gwe-iag (Ojibwa)	Used as rubbing and smelling medicine, and as a remedy for stomach trouble [Ojibwa: 86]. 
Lamiaceae, Herb		
Moneses uniflora (L.) A. Gray	single delight, one-flowered wintergreen (Eng.); monésès uniflore (Fr.)	Steeped to make a medicine for paralysis [Algonquians: 63].
Pyrolaceae, Herb		
Monotropa uniflora L.	Indian pipe (Eng.); monotrope uniflore (Fr.); mīpitahmaskīhkīh (Cree)	Juice mixed with water and applied to sore eyes [44]. 
Monotropaceae, Herb		Flower: Chewed to relieve toothache [Cree: 95].
Morella pensylvanica (Mirb.) Kartesz	northern bayberry (Eng.); myrique de Pennsylvanie (Fr.)	Roots: Powdered, steeped in water, and applied for arthritis and rheumatism, or to treat kidney problems [Mi'kmaq: 62]. 
Myricaceae, Tree		Leaves: Steeped in water and the liquid used as a mouth wash for sore mouth [Mi'kmaq: 62]. 
